{
  "$schema": "https://raw.githubusercontent.com/Tommy-Raven/SSWG-mvm1.0/main/schemas/optimization_schema.json",
  "$id": "https://github.com/Tommy-Raven/SSWG-mvm1.0/tree/main/data/templates/system_optimization_template.json",
  "anchor": {
    "anchor_id": "system_optimization_template",
    "anchor_version": "1.0.0",
    "scope": "data/templates",
    "owner": "sswg-mvm",
    "status": "draft"
  },
  "optimization_profile": {
    "domain": "Systems Engineering and Computer Science",
    "optimization_goal": "Determinism and Maximum Throughput",
    "system_interrelation_logic": "Optimizing process execution paths through hardware/software tuning in response to fluctuating computational environments.",
    "parameters": {
      "constants": [
        {
          "id": "PHYSICAL_LAYER_LIMIT",
          "name": "Hardware Constraints",
          "description": "The fixed physical capabilities of the system.",
          "examples": [
            "CPU_clock_speed",
            "bus_width",
            "memory_capacity",
            "optical_fiber_latency"
          ]
        },
        {
          "id": "ALGORITHMIC_COMPLEXITY",
          "name": "Big O Constant",
          "description": "The theoretical efficiency of the logic independent of hardware.",
          "examples": [
            "time_complexity",
            "space_complexity"
          ]
        },
        {
          "id": "PROTOCOL_STANDARDS",
          "name": "Syntax & Semantics",
          "description": "The fixed rules governing how data must be formatted to be valid.",
          "examples": [
            "TCP_header_size",
            "JSON_schema_constraints"
          ]
        }
      ],
      "variables": [
        {
          "id": "ENVIRONMENTAL_NOISE",
          "name": "System State Variables",
          "description": "External factors that fluctuate and degrade performance (similar to lane oil breakdown).",
          "examples": [
            "network_jitter",
            "thermal_throttling",
            "background_process_interference",
            "packet_loss"
          ]
        },
        {
          "id": "EQUIPMENT_CONFIGURATION",
          "name": "Heuristic Adjustments",
          "description": "Tuning the software/hardware interface to negate noise.",
          "examples": [
            "buffer_size_optimization",
            "compiler_flags",
            "cache_eviction_policies",
            "thread_pool_scaling"
          ]
        },
        {
          "id": "INPUT_MECHANISM",
          "name": "Instruction Set/Payload",
          "description": "The specific data or commands being processed.",
          "examples": [
            "request_volume",
            "data_packet_size",
            "concurrency_level"
          ]
        }
      ]
    },
    "mapping_relations": {
      "bowling_lane_oil": "cache_thrashing_or_memory_fragmentation",
      "dart_flight_aerodynamics": "packet_routing_efficiency",
      "f1_tire_degradation": "SSD_write_endurance_or_battery_wear",
      "archery_wind_compensation": "error_correction_algorithms_ECC",
      "antenna_signal_alignment": "load_balancer_weight_distribution"
    }
  },
  "workflow_profile": {
    "schema_version": "2.0.1-2025",
    "workflow_id": "cross_domain_optimization_map",
    "metadata": {
      "intent": "Recursive mapping of physical trajectory variables to computational state variables",
      "last_updated": "2025-12-31"
    },
    "definitions": {
      "constants": [
        {
          "uuid": "c-001-entropy-floor",
          "key": "ENVIRONMENTAL_BASE_NOISE",
          "domain_values": {
            "bowling": "lane_friction_coefficient",
            "darts": "gravitational_constant",
            "cs_systems": "signal_noise_floor"
          },
          "constraint": "immutable"
        },
        {
          "uuid": "c-002-target-threshold",
          "key": "PERFECTION_METRIC",
          "domain_values": {
            "bowling": "300_score",
            "darts": "nine_dart_finish",
            "cs_systems": "zero_latency_determinism"
          },
          "constraint": "fixed_at_initialization"
        }
      ],
      "variables": [
        {
          "uuid": "v-101-interface-friction",
          "key": "MEDIUM_RESISTANCE",
          "type": "float",
          "telemetry_source": "environmental_sensors",
          "recursive_node": {
            "mapping_logic": "compensation_loop",
            "sub_variables": [
              {
                "id": "DYNAMIC_DEGRADATION",
                "impact_vector": "accuracy_decay",
                "examples": [
                  "oil_transition",
                  "thermal_throttling"
                ]
              },
              {
                "id": "GEOMETRIC_DRIFT",
                "impact_vector": "path_deviation",
                "examples": [
                  "dart_wobble",
                  "clock_skew"
                ]
              }
            ]
          }
        },
        {
          "uuid": "v-102-actuator-adjustment",
          "key": "EQUIPMENT_MODIFIER",
          "type": "object",
          "telemetry_source": "player_system_input",
          "recursive_node": {
            "mapping_logic": "negation_loop",
            "sub_variables": [
              {
                "id": "SURFACE_OPTIMIZATION",
                "action": "modify_friction",
                "examples": [
                  "ball_sanding",
                  "cache_prefetch_tuning"
                ]
              },
              {
                "id": "AERODYNAMIC_STABILIZATION",
                "action": "modify_flow",
                "examples": [
                  "flight_selection",
                  "load_balancing_algorithm"
                ]
              }
            ]
          }
        }
      ]
    },
    "workflow_logic": {
      "recursion_depth_limit": 5,
      "termination_condition": "metric_delta <= epsilon",
      "execution_steps": [
        "MEASURE: environmental_base_noise",
        "COMPUTE: path_deviation(medium_resistance)",
        "APPLY: equipment_modifier(negation_loop)",
        "RECURSE: if result != perfection_metric"
      ]
    }
  }
}
